<!ELEMENT planes_for_sale (ad)+>
<!ELEMENT ad (year, make, model, color, description, seller, location)>
<!ELEMENT year (#PCDATA)>
<!ELEMENT make (#PCDATA)>
<!ELEMENT model (#PCDATA)>
<!ELEMENT color (#PCDATA)>
<!ELEMENT description (#PCDATA)>
<!ELEMENT seller (#PCDATA)>
<!ELEMENT location (city, state)>
<!ELEMENT city (#PCDATA)>
<!ELEMENT state (#PCDATA)>
